{
  "status": "collecting",
  "publication_status": "not_published",
  "last_updated": "2026-08-09",
  "purpose": "Private review queue for legitimate public source material. This file is not the public Hidden Fee Index and must not be used to publish market-wide findings without verification and methodology review.",
  "records": [
    {
      "record_id": "R-2026-001",
      "source": "What the Rule on Unfair or Deceptive Fees means for you | Consumer Advice",
      "source_url": "https://consumer.ftc.gov/consumer-alerts/2025/05/what-rule-unfair-or-deceptive-fees-means-you",
      "source_type": "government_consumer_guidance",
      "organization": "Federal Trade Commission",
      "industry": "live_events_and_short_term_lodging",
      "document_type": "consumer_alert",
      "date_collected": "2026-08-08",
      "source_date": "2025-05-12",
      "fee_terminology": "mandatory fees; government charges; optional add-ons",
      "fee_category": "mandatory_fee_disclosure",
      "fee_amount": null,
      "currency": null,
      "recurring_status": "not_stated",
      "contract_clause": null,
      "cancellation_requirements": null,
      "renewal_terms": null,
      "evidence": "The FTC consumer guidance states that covered live-event ticket and short-term-lodging sellers must include known required fees in the upfront price and disclose certain additional charges before asking for final payment.",
      "evidence_reference": "Article paragraphs describing the Rule’s covered sellers, upfront required fees, and later-disclosed taxes or shipping",
      "verification_status": "verified",
      "verification": {
        "reviewer": "Codex direct-source review",
        "reviewed_at": "2026-08-08",
        "method": "Opened the canonical HTTPS page and confirmed the title, FTC publisher, publication metadata, and evidence statement.",
        "source_http_status": 200
      },
      "notes": "Issue-specific consumer guidance for covered tickets and short-term lodging; it does not establish a general rule for every industry or a prevalence statistic."
    },
    {
      "record_id": "R-2026-002",
      "source": "Junk fees | Consumer Financial Protection Bureau",
      "source_url": "https://www.consumerfinance.gov/rules-policy/junk-fees/",
      "source_type": "government_policy_resource",
      "organization": "Consumer Financial Protection Bureau",
      "industry": "banking_and_consumer_finance",
      "document_type": "policy_resource",
      "date_collected": "2026-08-08",
      "source_date": "2024-03-05",
      "fee_terminology": "overdraft fees; nonsufficient funds fees; depositor fees",
      "fee_category": "consumer_finance_penalty_fee",
      "fee_amount": null,
      "currency": null,
      "recurring_status": "not_stated",
      "contract_clause": null,
      "cancellation_requirements": null,
      "renewal_terms": null,
      "evidence": "The CFPB resource describes its junk-fee initiative and identifies surprise depositor fees, surprise overdraft fees, and related banking-fee policy and research topics.",
      "evidence_reference": "Junk fees page headings and sections on hidden costs, surprise depositor fees, and surprise overdraft fees",
      "verification_status": "verified",
      "verification": {
        "reviewer": "Codex direct-source review",
        "reviewed_at": "2026-08-08",
        "method": "Opened the canonical HTTPS page and confirmed the title, CFPB publisher, last-modified date, and evidence statement.",
        "source_http_status": 200
      },
      "notes": "A CFPB policy/resource hub rather than a representative sample; it supports terminology and source context, not a DetectHiddenFees prevalence estimate."
    },
    {
      "record_id": "R-2026-003",
      "source": "Check your medical bill for errors | CMS",
      "source_url": "https://www.cms.gov/medical-bill-rights/help/guides/bill-errors",
      "source_type": "government_consumer_guidance",
      "organization": "Centers for Medicare & Medicaid Services",
      "industry": "healthcare_billing",
      "document_type": "consumer_guide",
      "date_collected": "2026-08-08",
      "source_date": "2024-11-05",
      "fee_terminology": "detailed bill; explanation of benefits; billing error",
      "fee_category": "billing_error_review",
      "fee_amount": null,
      "currency": null,
      "recurring_status": "not_stated",
      "contract_clause": null,
      "cancellation_requirements": null,
      "renewal_terms": null,
      "evidence": "CMS recommends requesting a detailed bill, comparing the patient share with the explanation of benefits, comparing the bill with medical records, and checking for duplicate services or mismatched billing codes.",
      "evidence_reference": "Guide action steps for a detailed bill, explanation of benefits, medical records, duplicate billing, and billing codes",
      "verification_status": "verified",
      "verification": {
        "reviewer": "Codex direct-source review",
        "reviewed_at": "2026-08-08",
        "method": "Opened the canonical HTTPS page and confirmed the title, CMS publisher, last-modified date, and evidence statement.",
        "source_http_status": 200
      },
      "notes": "Consumer review guidance; it does not establish an error rate or determine whether a particular bill is legally valid."
    },
    {
      "record_id": "R-2026-004",
      "source": "What is a Finance and Insurance (F&I) department? | Consumer Financial Protection Bureau",
      "source_url": "https://www.consumerfinance.gov/ask-cfpb/what-is-a-finance-and-insurance-fi-department-en-747/",
      "source_type": "government_consumer_guidance",
      "organization": "Consumer Financial Protection Bureau",
      "industry": "automotive_finance",
      "document_type": "consumer_answer",
      "date_collected": "2026-08-08",
      "source_date": "2024-01-30",
      "fee_terminology": "optional add-on products; auto loan features",
      "fee_category": "automotive_add_on",
      "fee_amount": null,
      "currency": null,
      "recurring_status": "not_stated",
      "contract_clause": null,
      "cancellation_requirements": "The page notes that consumers may have a right to cancel some add-on products later.",
      "renewal_terms": null,
      "evidence": "The CFPB explains that a dealership F&I department handles financing, contracts, paperwork, and optional add-on products; it also states that add-ons are not required to secure dealer financing and may be cancellable later depending on the circumstances.",
      "evidence_reference": "Answer paragraphs defining F&I work, optional add-ons, loan amount effects, and possible cancellation rights",
      "verification_status": "verified",
      "verification": {
        "reviewer": "Codex direct-source review",
        "reviewed_at": "2026-08-08",
        "method": "Opened the canonical HTTPS page and confirmed the title, CFPB publisher, last-modified date, and evidence statement.",
        "source_http_status": 200
      },
      "notes": "General consumer guidance; cancellation rights are product- and jurisdiction-dependent and are not determined by this record."
    },
    {
      "record_id": "R-2026-005",
      "source": "What things can I negotiate when shopping for a car or auto loan? | Consumer Financial Protection Bureau",
      "source_url": "https://www.consumerfinance.gov/ask-cfpb/what-things-can-i-negotiate-when-shopping-for-a-car-or-auto-loan-en-2132/",
      "source_type": "government_consumer_guidance",
      "organization": "Consumer Financial Protection Bureau",
      "industry": "automotive_finance",
      "document_type": "consumer_answer",
      "date_collected": "2026-08-08",
      "source_date": "2024-08-28",
      "fee_terminology": "prepayment penalty; preparation fee; origination fee; document fee; delivery charge; market adjustment",
      "fee_category": "automotive_transaction_fee",
      "fee_amount": null,
      "currency": null,
      "recurring_status": "not_stated",
      "contract_clause": null,
      "cancellation_requirements": null,
      "renewal_terms": null,
      "evidence": "The CFPB lists possible dealer or loan charges including preparation, origination, document, delivery, and market-adjustment fees, and distinguishes those from taxes, title, and registration fees set by government.",
      "evidence_reference": "Sections on optional add-on products, additional vehicle or loan fees, and non-negotiable government fees",
      "verification_status": "verified",
      "verification": {
        "reviewer": "Codex direct-source review",
        "reviewed_at": "2026-08-08",
        "method": "Opened the canonical HTTPS page and confirmed the title, CFPB publisher, last-modified date, and evidence statement.",
        "source_http_status": 200
      },
      "notes": "Consumer negotiation guidance; it lists examples but does not support a claim about fee frequency, legality, or typical amount."
    },
    {
      "record_id": "R-2026-006",
      "source": "What can I do if my bank charged me a fee for overdrawing my account? | Consumer Financial Protection Bureau",
      "source_url": "https://www.consumerfinance.gov/ask-cfpb/what-can-i-do-if-my-bank-charged-me-a-fee-for-overdrawing-my-account-en-1037/",
      "source_type": "government_consumer_guidance",
      "organization": "Consumer Financial Protection Bureau",
      "industry": "banking",
      "document_type": "consumer_answer",
      "date_collected": "2026-08-08",
      "source_date": "2025-01-02",
      "fee_terminology": "overdraft fee; nonsufficient funds fee; returned item fee",
      "fee_category": "overdraft_and_returned_payment",
      "fee_amount": null,
      "currency": null,
      "recurring_status": "not_stated",
      "contract_clause": "Overdraft protection enrollment and account terms",